id,title,subtitle,credits,script,dataPath,imgPath,caption,chartType,columns,URL,topic
54,Newsroom spending for cable TV,Combined newsroom spending (in U.S. dollars),"Note: Numbers are estimates and projections prepared by Kagan, a media research group in S&P Global Market Intelligence, and often are revised annually, even for previous years. Displayed numbers indicate most recent updates.
Source: Estimates and projections by Kagan, a media research group within the TMT offering of S&P Global Market Intelligence.","chart[62632] = [{""colors"":[""#733D47"",""#BC7B86"",""#D1A8AF"",""#E8D3D7"",""#552E35""],""plotOptions"":{""line"":{""marker"":{""fillColor"":null,""lineWidth"":2,""lineColor"":null,""enabled"":true}},""area"":{""lineWidth"":0,""marker"":{""enabled"":true}},""scatter"":{""marker"":{""fillColor"":null}},""bar"":{""stacking"":null},""column"":{""stacking"":null},""pie"":{""visible"":true,""dataLabels"":{""enabled"":true}}},""chart"":{""type"":""line"",""zoomType"":""none""},""subtitle"":{""text"":""Combined newsroom spending (in U.S. dollars)""},""xAxis"":{""title"":[],""type"":""linear""},""yAxis"":{""title"":[],""max"":""6000000000""},""misc"":{""inlineTooltips"":false},""html"":{""waypoints"":false,""data_tab"":""Data"",""chart_tab"":""Chart"",""share_tab"":""Share"",""height"":""400px"",""iframe"":true,""iframe_tab"":""Embed"",""iframe_text"":""Copy and paste the below iframe code into your own website to embed this chart."",""title"":""Newsroom spending for cable TV"",""subtitle"":""Combined newsroom spending (in U.S. dollars)"",""URL"":""https:\/\/www.journalism.org\/chart\/sotnm-cable-newsroom-spending-for-cable-tv\/"",""id"":62632,""slug"":""sotnm-cable-newsroom-spending-for-cable-tv"",""domain"":""https:\/\/www.journalism.org"",""credits"":""Note: Numbers are estimates and projections prepared by Kagan, a media research group in S&P Global Market Intelligence, and often are revised annually, even for previous years. Displayed numbers indicate most recent updates.<br> Source: Estimates and projections by Kagan, a media research group within the TMT offering of S&P Global Market Intelligence."",""creditsURL"":false,""creditText"":"" ""}}];",out/multi_col/data/54.csv,out/multi_col/imgs/54.png,"Total newsroom spending by the three channels combined increased by 5% in 2018 to a total of $2.4 billion, according to estimates by Kagan. Newsroom spending at the three major financial networks was $725 million, a 3% change.",line,"['Year', 'Fox News, CNN and MSNBC', 'CNBC, Fox Business and Bloomberg']",https://www.journalism.org/fact-sheet/cable-news/,Journalism & Media
56,Mobile phone ownership over time,% of U.S. adults who own the following devices,Source: Surveys conducted 2002-2019.,"chart[17312] = [{""colors"":[""#006699"",""#7591b7"",""#9daecb"",""#c9d1e1"",""#002748""],""plotOptions"":{""line"":{""marker"":{""fillColor"":null,""lineWidth"":2,""lineColor"":null,""enabled"":false}},""area"":{""lineWidth"":0,""marker"":{""enabled"":false}},""scatter"":{""marker"":{""fillColor"":null}},""bar"":{""stacking"":null},""column"":{""stacking"":null},""pie"":{""visible"":true,""dataLabels"":{""enabled"":true}}},""chart"":{""type"":""line"",""zoomType"":""none""},""subtitle"":{""text"":""% of U.S. adults who own the following devices""},""xAxis"":{""title"":[],""type"":""datetime""},""yAxis"":{""title"":[],""max"":""100""},""misc"":{""inlineTooltips"":false},""html"":{""waypoints"":false,""data_tab"":""Data"",""chart_tab"":""Chart"",""share_tab"":""Share"",""height"":""400px"",""iframe"":true,""iframe_tab"":""Embed"",""iframe_text"":""Copy and paste the below iframe code into your own website to embed this chart."",""title"":""Mobile phone ownership"",""subtitle"":""% of U.S. adults who own the following devices"",""URL"":""https:\/\/www.pewresearch.org\/internet\/chart\/mobile-phone-ownership\/"",""id"":17312,""slug"":""mobile-phone-ownership"",""domain"":""https:\/\/www.pewresearch.org\/internet"",""credits"":""Source: Surveys conducted 2002-2019."",""creditsURL"":false,""creditText"":"" ""}}];",out/multi_col/data/56.csv,out/multi_col/imgs/56.png,"The vast majority of Americans – 96% – now own a cellphone of some kind. The share of Americans that own smartphones is now 81%, up from just 35% in Pew Research Center’s first survey of smartphone ownership conducted in 2011. Along with mobile phones, Americans own a range of other information devices. Nearly three-quarters of U.S. adults now own desktop or laptop computers, while roughly half now own tablet computers and roughly half own e-reader devices.",line,"['Date', 'Cellphone', 'Smartphone']",https://www.pewresearch.org/internet/fact-sheet/mobile/,Internet & Technology
57,Ownership of other devices,% of U.S. adults who own the following devices,Source: Surveys conducted 2008-2019.,"chart[17918] = [{""colors"":[""#006699"",""#7591b7"",""#9daecb"",""#c9d1e1"",""#002748""],""plotOptions"":{""line"":{""marker"":{""fillColor"":null,""lineWidth"":2,""lineColor"":null,""enabled"":false}},""area"":{""lineWidth"":0,""marker"":{""enabled"":false}},""scatter"":{""marker"":{""fillColor"":null}},""bar"":{""stacking"":null},""column"":{""stacking"":null},""pie"":{""visible"":true,""dataLabels"":{""enabled"":true}}},""chart"":{""type"":""line"",""zoomType"":""none""},""subtitle"":{""text"":""% of U.S. adults who own the following devices""},""xAxis"":{""title"":[],""type"":""datetime""},""yAxis"":{""title"":[],""max"":""100""},""misc"":{""inlineTooltips"":false},""html"":{""waypoints"":false,""data_tab"":""Data"",""chart_tab"":""Chart"",""share_tab"":""Share"",""height"":""400px"",""iframe"":true,""iframe_tab"":""Embed"",""iframe_text"":""Copy and paste the below iframe code into your own website to embed this chart."",""title"":""Ownership of other devices"",""subtitle"":""% of U.S. adults who own the following devices"",""URL"":""https:\/\/www.pewresearch.org\/internet\/chart\/ownership-of-other-devices\/"",""id"":17918,""slug"":""ownership-of-other-devices"",""domain"":""https:\/\/www.pewresearch.org\/internet"",""credits"":""Source: Surveys conducted 2008-2019."",""creditsURL"":false,""creditText"":"" ""}}];",out/multi_col/data/57.csv,out/multi_col/imgs/57.png,"Along with mobile phones, Americans own a range of other information devices. Nearly three-quarters of U.S. adults now own desktop or laptop computers, while roughly half now own tablet computers and roughly half own e-reader devices.",line,"['Date', 'E-reader', 'Tablet computer', 'Desktop/laptop computer']",https://www.pewresearch.org/internet/fact-sheet/mobile/,Internet & Technology
58,Which social media platforms are most popular,% of U.S. adults who use ...,"Source: Surveys conducted 2012-2019.
","chart[17383] = [{""colors"":[""#006699"",""#7591b7"",""#9daecb"",""#c9d1e1"",""#002748""],""plotOptions"":{""line"":{""marker"":{""fillColor"":null,""lineWidth"":2,""lineColor"":null,""enabled"":true}},""area"":{""lineWidth"":0,""marker"":{""enabled"":true}},""scatter"":{""marker"":{""fillColor"":null}},""bar"":{""stacking"":null},""column"":{""stacking"":null},""pie"":{""visible"":true,""dataLabels"":{""enabled"":true}}},""chart"":{""type"":""line"",""zoomType"":""none""},""subtitle"":{""text"":""% of U.S. adults who use ...""},""xAxis"":{""title"":[],""type"":""datetime""},""yAxis"":{""title"":[],""max"":""100""},""misc"":{""inlineTooltips"":false},""html"":{""waypoints"":false,""data_tab"":""Data"",""chart_tab"":""Chart"",""share_tab"":""Share"",""height"":""400px"",""iframe"":true,""iframe_tab"":""Embed"",""iframe_text"":""Copy and paste the below iframe code into your own website to embed this chart."",""title"":""Which social media platforms are most popular"",""subtitle"":""% of U.S. adults who use ..."",""URL"":""https:\/\/www.pewresearch.org\/internet\/chart\/which-social-media-platforms-are-most-popular\/"",""id"":17383,""slug"":""which-social-media-platforms-are-most-popular"",""domain"":""https:\/\/www.pewresearch.org\/internet"",""credits"":""Source: Surveys conducted 2012-2019."",""creditsURL"":false,""creditText"":"" ""}}];",out/multi_col/data/58.csv,out/multi_col/imgs/58.png,"YouTube and Facebook are the most-widely used online platforms, and its user base is most broadly representative of the population as a whole. Smaller shares of Americans use sites such as Twitter, Pinterest, Instagram and LinkedIn.",line,"['Date', 'Facebook', 'Pinterest', 'Instagram', 'LinkedIn', 'Twitter', 'Snapchat', 'YouTube', 'WhatsApp', 'Reddit']",https://www.pewresearch.org/internet/fact-sheet/social-media/,Internet & Technology
59,How often Americans use social media sites,"Among the users of each social media site, the % who use that site with the following frequencies","Note: Numbers may not add to 100 due to rounding.
Source: Survey conducted Jan. 8 to Feb. 7, 2019.","chart[17381] = [{""colors"":[""#006699"",""#7591b7"",""#9daecb"",""#c9d1e1"",""#002748""],""plotOptions"":{""line"":{""marker"":{""fillColor"":null,""lineWidth"":2,""lineColor"":null,""enabled"":true},""stacking"":""normal""},""area"":{""lineWidth"":0,""marker"":{""enabled"":true},""stacking"":""normal""},""scatter"":{""marker"":{""fillColor"":null}},""bar"":{""stacking"":""normal""},""column"":{""stacking"":""normal""},""pie"":{""visible"":true,""dataLabels"":{""enabled"":true}}},""chart"":{""type"":""bar"",""zoomType"":""none""},""subtitle"":{""text"":""Among the users of each social media site, the % who use that site with the following frequencies""},""xAxis"":{""title"":[],""type"":""linear""},""yAxis"":{""title"":[],""max"":""100""},""misc"":{""inlineTooltips"":false},""html"":{""waypoints"":false,""data_tab"":""Data"",""chart_tab"":""Chart"",""share_tab"":""Share"",""height"":""400px"",""iframe"":true,""iframe_tab"":""Embed"",""iframe_text"":""Copy and paste the below iframe code into your own website to embed this chart."",""title"":""How often Americans are using social media"",""subtitle"":""Among the users of each social media site, the % who use that site with the following frequencies"",""URL"":""https:\/\/www.pewresearch.org\/internet\/chart\/how-often-americans-are-using-social-media\/"",""id"":17381,""slug"":""how-often-americans-are-using-social-media"",""domain"":""https:\/\/www.pewresearch.org\/internet"",""credits"":""Note: Numbers may not add to 100 due to rounding. <br>Source: Survey conducted Jan. 8 to Feb. 7, 2019."",""creditsURL"":false,""creditText"":"" ""},""legend"":{""reversed"":true}}];",out/multi_col/data/59.csv,out/multi_col/imgs/59.png,"For many users, social media is part of their daily routine. Roughly three-quarters of Facebook users – and around six-in-ten Instagram users – visit these sites at least once a day.",bar,"['Platform', 'Less often', 'Weekly', 'Daily']",https://www.pewresearch.org/internet/fact-sheet/social-media/,Internet & Technology
60,Public opinion on same-sex marriage,% of U.S. adults who favor/oppose same-sex marriage (2001-2019),,"chart[31442] = [{""colors"":[""#0090c0"",""#c9deee"",""#9dc7e1"",""#0073a5"",""#00557e""],""plotOptions"":{""line"":{""marker"":{""fillColor"":null,""lineWidth"":2,""lineColor"":null,""enabled"":false}},""area"":{""lineWidth"":0,""marker"":{""enabled"":false}},""scatter"":{""marker"":{""fillColor"":null}},""bar"":{""stacking"":null},""column"":{""stacking"":null},""pie"":{""visible"":true,""dataLabels"":{""enabled"":true}}},""chart"":{""type"":""line"",""zoomType"":""none""},""subtitle"":{""text"":""% of U.S. adults who favor\/oppose same-sex marriage (2001-2019)""},""xAxis"":{""title"":[],""type"":""datetime""},""yAxis"":{""title"":[]},""misc"":{""inlineTooltips"":false},""html"":{""waypoints"":""true"",""data_tab"":""Data"",""chart_tab"":""Chart"",""share_tab"":""Share"",""height"":""400px"",""iframe"":"""",""iframe_tab"":""Embed"",""iframe_text"":""Copy and paste the below iframe code into your own website to embed this chart."",""title"":""Same-sex marriage overall"",""subtitle"":""% of U.S. adults who favor\/oppose same-sex marriage (2001-2019)"",""URL"":""https:\/\/www.pewforum.org\/chart\/same-sex-marriage-overall\/"",""id"":31442,""slug"":""same-sex-marriage-overall"",""domain"":""https:\/\/www.pewforum.org"",""credits"":"""",""creditsURL"":false,""creditText"":"" ""}}];",out/multi_col/data/60.csv,out/multi_col/imgs/60.png,"In Pew Research Center polling in 2004, Americans opposed same-sex marriage by a margin of 60% to 31%.
Support for same-sex marriage has steadily grown over the past 15 years. And today, support for same-sex marriage remains near its highest point since Pew Research Center began polling on this issue. Based on polling in 2019, a majority of Americans (61%) support same-sex marriage, while 31% oppose it.",line,"['Year', 'Favor', 'Oppose']",https://www.pewforum.org/fact-sheet/changing-attitudes-on-gay-marriage/,Religion & Public Life
61,Public trust in government near historic lows,% who trust the govt in Washington always or most of the time,,"chart[20059071] = [{""chart"":{""type"":""line"",""zoomType"":""xy""},""subtitle"":{""text"":""% who trust the govt in Washington always or most of the time""},""xAxis"":{""title"":[],""type"":""datetime"",""plotBands"":[{""color"":""#F5F4EF"",""from"":-978307200000,""to"":-780278400000,""label"":{""text"":""Roosevelt"",""rotation"":-90,""verticalAlign"":""bottom"",""y"":-12,""textAlign"":""left"",""style"":{""color"":""#456A83""}}},{""color"":""#FFFFFF"",""from"":-780192000000,""to"":-534902400000,""label"":{""text"":""Truman"",""rotation"":-90,""verticalAlign"":""bottom"",""y"":-12,""textAlign"":""left"",""style"":{""color"":""#456A83""}}},{""color"":""#F5F4EF"",""from"":-534816000000,""to"":-282441600000,""label"":{""text"":""Eisenhower"",""rotation"":-90,""verticalAlign"":""bottom"",""y"":-12,""textAlign"":""left"",""style"":{""color"":""#BF3B27""}}},{""color"":""#FFFFFF"",""from"":-282355200000,""to"":-192931200000,""label"":{""text"":""Kennedy"",""rotation"":-90,""verticalAlign"":""bottom"",""y"":-12,""textAlign"":""left"",""style"":{""color"":""#456A83""}}},{""color"":""#F5F4EF"",""from"":-192844800000,""to"":-29980800000,""label"":{""text"":""Johnson"",""rotation"":-90,""verticalAlign"":""bottom"",""y"":-12,""textAlign"":""left"",""style"":{""color"":""#456A83""}}},{""color"":""#FFFFFF"",""from"":-29894400000,""to"":145152000000,""label"":{""text"":""Nixon"",""rotation"":-90,""verticalAlign"":""top"",""textAlign"":""right"",""style"":{""color"":""#BF3B27""}}},{""color"":""#F5F4EF"",""from"":145238400000,""to"":222480000000,""label"":{""text"":""Ford"",""rotation"":-90,""verticalAlign"":""top"",""textAlign"":""right"",""style"":{""color"":""#BF3B27""}}},{""color"":""#FFFFFF"",""from"":222566400000,""to"":348710400000,""label"":{""text"":""Carter"",""rotation"":-90,""verticalAlign"":""top"",""textAlign"":""right"",""style"":{""color"":""#456A83""}}},{""color"":""#F5F4EF"",""from"":348796800000,""to"":601171200000,""label"":{""text"":""Reagan"",""rotation"":-90,""verticalAlign"":""top"",""textAlign"":""right"",""style"":{""color"":""#BF3B27""}}},{""color"":""#FFFFFF"",""from"":601257600000,""to"":727401600000,""label"":{""text"":""Bush"",""rotation"":-90,""verticalAlign"":""top"",""textAlign"":""right"",""style"":{""color"":""#BF3B27""}}},{""color"":""#F5F4EF"",""from"":727488000000,""to"":979862400000,""label"":{""text"":""Clinton"",""rotation"":-90,""verticalAlign"":""top"",""textAlign"":""right"",""style"":{""color"":""#456A83""}}},{""color"":""#FFFFFF"",""from"":979948800000,""to"":1232323200000,""label"":{""text"":""G.W. Bush"",""rotation"":-90,""verticalAlign"":""top"",""textAlign"":""right"",""style"":{""color"":""#BF3B27""}}},{""color"":""#F5F4EF"",""from"":1232409600000,""to"":1484937155000,""label"":{""text"":""Obama"",""rotation"":-90,""verticalAlign"":""top"",""textAlign"":""right"",""style"":{""color"":""#456A83""}}},{""color"":""#FFFFFF"",""from"":1484937155000,""to"":1514741042000,""label"":{""text"":""Trump"",""rotation"":-90,""x"":9,""verticalAlign"":""top"",""textAlign"":""right"",""style"":{""color"":""#BF3B27""}}}],""labels"":{""format"":""{value:%Y}""},""lineColor"":""darkgray"",""tickWidth"":1,""tickColor"":""darkgray"",""tickLength"":8},""yAxis"":{""title"":[]},""plotOptions"":{""line"":{""marker"":{""enabled"":true}},""area"":{""marker"":{""enabled"":true}},""bar"":{""stacking"":null},""column"":{""stacking"":null},""pie"":{""visible"":true,""dataLabels"":{""enabled"":true}},""series"":{""connectNulls"":false,""lineWidth"":2.5,""enableMouseTracking"":true,""marker"":{""enabled"":false}}},""misc"":{""inlineTooltips"":false},""html"":{""waypoints"":false,""data_tab"":""Data"",""chart_tab"":""Chart"",""share_tab"":""Share"",""height"":""500px"",""iframe"":""true"",""iframe_tab"":""Embed"",""iframe_text"":""Copy and paste the below iframe code into your own website to embed this chart."",""title"":""Public trust in government near historic lows"",""subtitle"":""% who trust the govt in Washington always or most of the time"",""URL"":""https:\/\/www.pewresearch.org\/politics\/chart\/public-trust-in-government-near-historic-lows\/"",""id"":20059071,""slug"":""public-trust-in-government-near-historic-lows"",""domain"":""https:\/\/www.pewresearch.org\/politics"",""credits"":null,""creditsURL"":false,""creditText"":"" ""},""legend"":{""itemStyle"":{""fontWeight"":""normal""},""reversed"":""true""},""credits"":{""enabled"":""true"",""text"":""click legend items to remove them from chart"",""href"":""javascript:void(0)"",""position"":{""align"":""center"",""x"":10,""y"":-13},""style"":{""color"":""#000000"",""cursor"":""auto"",""fontSize"":""12px"",""fontWeight"":""bold"",""font-variant"":""small-caps""}},""tooltip"":{""xDateFormat"":""%b %Y""}}];",out/multi_col/data/61.csv,out/multi_col/imgs/61.png,"Public trust in the government remains near historic lows. Only 17% of Americans today say they can trust the government in Washington to do what is right “just about always” (3%) or “most of the time” (14%).
When the National Election Study began asking about trust in government in 1958, about three-quarters of Americans trusted the federal government to do the right thing almost always or most of the time. Trust in government began eroding during the 1960s, amid the escalation of the Vietnam War, and the decline continued in the 1970s with the Watergate scandal and worsening economic struggles. Confidence in government recovered in the mid-1980s before falling again in the mid-1990s. But as the economy grew in the late 1990s so too did confidence in government. Public trust reached a three-decade high shortly after the 9/11 terrorist attacks, but declined quickly thereafter. Since 2007, the share saying they can trust the government always or most of the time has not surpassed 30%.",line,"['Date', '.', 'Individual polls', 'Moving average']",https://www.pewresearch.org/politics/2019/04/11/public-trust-in-government-1958-2019/,U.S. Politics & Policy
62,Trust in govt higher among members of party that controls presidency,% who trust the govt in Washington always or most of the time,,"chart[20059077] = [{""chart"":{""type"":""line"",""zoomType"":""xy""},""subtitle"":{""text"":""% who trust the govt in Washington always or most of the time""},""xAxis"":{""title"":[],""type"":""datetime"",""plotBands"":[{""color"":""#F5F4EF"",""from"":-978307200000,""to"":-780278400000,""label"":{""text"":""Roosevelt"",""rotation"":-90,""verticalAlign"":""bottom"",""y"":-12,""textAlign"":""left"",""style"":{""color"":""#456A83""}}},{""color"":""#FFFFFF"",""from"":-780192000000,""to"":-534902400000,""label"":{""text"":""Truman"",""rotation"":-90,""verticalAlign"":""bottom"",""y"":-12,""textAlign"":""left"",""style"":{""color"":""#456A83""}}},{""color"":""#F5F4EF"",""from"":-534816000000,""to"":-282441600000,""label"":{""text"":""Eisenhower"",""rotation"":-90,""verticalAlign"":""bottom"",""y"":-12,""textAlign"":""left"",""style"":{""color"":""#BF3B27""}}},{""color"":""#FFFFFF"",""from"":-282355200000,""to"":-192931200000,""label"":{""text"":""Kennedy"",""rotation"":-90,""verticalAlign"":""bottom"",""y"":-12,""textAlign"":""left"",""style"":{""color"":""#456A83""}}},{""color"":""#F5F4EF"",""from"":-192844800000,""to"":-29980800000,""label"":{""text"":""Johnson"",""rotation"":-90,""verticalAlign"":""bottom"",""y"":-12,""textAlign"":""left"",""style"":{""color"":""#456A83""}}},{""color"":""#FFFFFF"",""from"":-29894400000,""to"":145152000000,""label"":{""text"":""Nixon"",""rotation"":-90,""verticalAlign"":""top"",""textAlign"":""right"",""style"":{""color"":""#BF3B27""}}},{""color"":""#F5F4EF"",""from"":145238400000,""to"":222480000000,""label"":{""text"":""Ford"",""rotation"":-90,""verticalAlign"":""top"",""textAlign"":""right"",""style"":{""color"":""#BF3B27""}}},{""color"":""#FFFFFF"",""from"":222566400000,""to"":348710400000,""label"":{""text"":""Carter"",""rotation"":-90,""verticalAlign"":""top"",""textAlign"":""right"",""style"":{""color"":""#456A83""}}},{""color"":""#F5F4EF"",""from"":348796800000,""to"":601171200000,""label"":{""text"":""Reagan"",""rotation"":-90,""verticalAlign"":""top"",""textAlign"":""right"",""style"":{""color"":""#BF3B27""}}},{""color"":""#FFFFFF"",""from"":601257600000,""to"":727401600000,""label"":{""text"":""Bush"",""rotation"":-90,""verticalAlign"":""top"",""textAlign"":""right"",""style"":{""color"":""#BF3B27""}}},{""color"":""#F5F4EF"",""from"":727488000000,""to"":979862400000,""label"":{""text"":""Clinton"",""rotation"":-90,""verticalAlign"":""top"",""textAlign"":""right"",""style"":{""color"":""#456A83""}}},{""color"":""#FFFFFF"",""from"":979948800000,""to"":1232323200000,""label"":{""text"":""G.W. Bush"",""rotation"":-90,""verticalAlign"":""top"",""textAlign"":""right"",""style"":{""color"":""#BF3B27""}}},{""color"":""#F5F4EF"",""from"":1232409600000,""to"":1484937155000,""label"":{""text"":""Obama"",""rotation"":-90,""verticalAlign"":""top"",""textAlign"":""right"",""style"":{""color"":""#456A83""}}},{""color"":""#FFFFFF"",""from"":1484937155000,""to"":1514741042000,""label"":{""text"":""Trump"",""rotation"":-90,""x"":9,""verticalAlign"":""top"",""textAlign"":""right"",""style"":{""color"":""#BF3B27""}}}],""labels"":{""format"":""{value:%Y}""},""lineColor"":""darkgray"",""tickWidth"":1,""tickColor"":""darkgray"",""tickLength"":8},""yAxis"":{""title"":[]},""plotOptions"":{""line"":{""marker"":{""enabled"":true}},""area"":{""marker"":{""enabled"":true}},""bar"":{""stacking"":null},""column"":{""stacking"":null},""pie"":{""visible"":true,""dataLabels"":{""enabled"":true}},""series"":{""connectNulls"":false,""lineWidth"":2.5,""enableMouseTracking"":true,""marker"":{""enabled"":false}}},""misc"":{""inlineTooltips"":false},""html"":{""waypoints"":false,""data_tab"":""Data"",""chart_tab"":""Chart"",""share_tab"":""Share"",""height"":""500px"",""iframe"":""true"",""iframe_tab"":""Embed"",""iframe_text"":""Copy and paste the below iframe code into your own website to embed this chart."",""title"":""Trust in govt higher among members of party that controls presidency"",""subtitle"":""% who trust the govt in Washington always or most of the time"",""URL"":""https:\/\/www.pewresearch.org\/politics\/chart\/trust-in-govt-higher-among-members-of-party-that-controls-presidency\/"",""id"":20059077,""slug"":""trust-in-govt-higher-among-members-of-party-that-controls-presidency"",""domain"":""https:\/\/www.pewresearch.org\/politics"",""credits"":null,""creditsURL"":false,""creditText"":"" ""},""legend"":{""itemStyle"":{""fontWeight"":""normal""},""reversed"":""true""},""credits"":{""enabled"":""true"",""text"":""click legend items to remove them from chart"",""href"":""javascript:void(0)"",""position"":{""align"":""center"",""x"":10,""y"":-13},""style"":{""color"":""#000000"",""cursor"":""auto"",""fontSize"":""12px"",""fontWeight"":""bold"",""font-variant"":""small-caps""}},""tooltip"":{""xDateFormat"":""%b %Y""}}];",out/multi_col/data/62.csv,out/multi_col/imgs/62.png,"Currently, 21% of Republicans and Republican-leaning independents say they can trust government, compared with 14% of Democrats and Democratic leaners. Throughout Obama’s tenure, more Democrats than Republicans reported trusting the government, though that has flipped since Trump’s election. Since the 1970s, trust in government has been consistently higher among members of the party that controls the White House than among the opposition party. However, Republicans have been much more reactive than Democrats to changes in political power. Republicans have expressed much higher levels of trust during Republican than during Democratic presidencies, while Democrats’ attitudes have tended to be more consistent, regardless of which party controls the White House.",line,"['Date', '.', 'No partisan lean', 'Democrat/Lean Dem', 'Republican/Lean Rep']",https://www.pewresearch.org/politics/2019/04/11/public-trust-in-government-1958-2019/,U.S. Politics & Policy
