id,title,subtitle,credits,script,dataPath,imgPath,caption,chartType,columns,URL,topic
25,"U.S. population with origins from Spain, 2010-2017",,"Note: Latino origin is based on self-described ancestry, lineage, heritage, nationality group or country of birth.
Source: Pew Research Center tabulations of 2000 census (5% IPUMS) and 2010, 2015 and 2017 American Community Surveys (1% IPUMS).","chart[28109] = [{""colors"":[""#A55A26"",""#DE996A"",""#E7BA9A"",""#F2DBCD"",""#7C441C""],""plotOptions"":{""line"":{""marker"":{""lineWidth"":2,""lineColor"":null,""enabled"":true},""stacking"":""normal""},""area"":{""lineWidth"":0,""marker"":{""enabled"":true},""stacking"":""normal""},""scatter"":{""marker"":{""fillColor"":null}},""bar"":{""stacking"":""normal""},""column"":{""stacking"":""normal""},""pie"":{""visible"":true,""dataLabels"":{""enabled"":true}}},""chart"":{""type"":""area"",""zoomType"":""none""},""subtitle"":[],""xAxis"":{""title"":[],""type"":""datetime""},""yAxis"":{""title"":[]},""misc"":{""inlineTooltips"":false},""html"":{""waypoints"":false,""data_tab"":""Data"",""chart_tab"":""Chart"",""share_tab"":""Share"",""height"":""400px"",""iframe"":true,""iframe_tab"":""Embed"",""iframe_text"":""Copy and paste the below iframe code into your own website to embed this chart."",""title"":""U.S. population with origins from Spain, 2010-2017"",""subtitle"":"""",""URL"":""https:\/\/www.pewresearch.org\/hispanic\/chart\/u-s-hispanics-spanish-origin-population\/"",""id"":28109,""slug"":""u-s-hispanics-spanish-origin-population"",""domain"":""https:\/\/www.pewresearch.org\/hispanic"",""credits"":""Note: Latino origin is based on self-described ancestry, lineage, heritage, nationality group or country of birth.<\/br>Source: Pew Research Center tabulations of 2000 census (5% IPUMS) and 2010, 2015 and 2017 American Community Surveys (1% IPUMS)."",""creditsURL"":false,""creditText"":"" ""}}];",out/multi_col/data/25.csv,out/multi_col/imgs/25.png,"An estimated 810,000 Hispanics with origins from Spain – that is, those who are immigrants from or who trace their family ancestry to Spain – resided in the United States in 2017, according to a Pew Research Center analysis of the U.S. Census Bureau’s American Community Survey. Spaniards in this statistical profile are people who self-identified as Hispanics with origins from Spain.
Spaniards are the ninth-largest population of Hispanic origin living in the United States, accounting for 1% of the U.S. Hispanic population in 2017. Since 2010, the population with origins from Spain has increased 15%, growing from 707,000 to 810,000 over the period. At the same time, the foreign-born population with origins from Spain living in the U.S. grew by 41%, from 91,000 in 2010 to 129,000 in 2017. By comparison, Mexicans, the nation’s largest Hispanic origin group, constituted 36.6 million, or 62%, of the Hispanic population in 2017.",area,"['Year', 'Foreign born', 'U.S. born']",https://www.pewresearch.org/hispanic/fact-sheet/u-s-hispanics-facts-on-spanish-origin-latinos/,Hispanic Trends
26,"Views on abortion, 1995-2019",% of U.S. adults who say abortion should be legal/illegal (1995-2019),,"chart[23858] = [{""colors"":[""#0090c0"",""#c9deee"",""#9dc7e1"",""#0073a5"",""#00557e""],""plotOptions"":{""line"":{""marker"":{""fillColor"":null,""lineWidth"":2,""lineColor"":null,""enabled"":true}},""area"":{""lineWidth"":0,""marker"":{""enabled"":true}},""scatter"":{""marker"":{""fillColor"":null}},""bar"":{""stacking"":null},""column"":{""stacking"":null},""pie"":{""visible"":true,""dataLabels"":{""enabled"":true}}},""chart"":{""type"":""line"",""zoomType"":""none""},""subtitle"":{""text"":""% of U.S. adults who say abortion should be legal\/illegal (1995-2019)""},""xAxis"":{""title"":[],""type"":""datetime""},""yAxis"":{""title"":[],""max"":""100""},""misc"":{""inlineTooltips"":false},""html"":{""waypoints"":""true"",""data_tab"":""Data"",""chart_tab"":""Chart"",""share_tab"":""Share"",""height"":""400px"",""iframe"":""true"",""iframe_tab"":""Embed"",""iframe_text"":""Copy and paste the below iframe code into your own website to embed this chart."",""title"":""Overall views on abortion"",""subtitle"":""% of U.S. adults who say abortion should be legal\/illegal (1995-2019)"",""URL"":""https:\/\/www.pewforum.org\/chart\/views-on-abortion\/"",""id"":23858,""slug"":""views-on-abortion"",""domain"":""https:\/\/www.pewforum.org"",""credits"":"""",""creditsURL"":false,""creditText"":"" ""}}];",out/multi_col/data/26.csv,out/multi_col/imgs/26.png,"As of 2019, public support for legal abortion remains as high as it has been in two decades of polling. Currently, 61% say abortion should be legal in all or most cases, while 38% say it should be illegal in all or most cases.",line,"['Year', 'Legal in all/most cases', 'Illegal in all/most cases']",https://www.pewforum.org/fact-sheet/public-opinion-on-abortion/,Religion & Public Life
27,"Views on abortion by religious affiliation, 2019","% of U.S. adults who say abortion should be legal/illegal, by religion (2019)",,"chart[23861] = [{""colors"":[""#0090c0"",""#c9deee"",""#9dc7e1"",""#0073a5"",""#00557e""],""plotOptions"":{""line"":{""marker"":{""fillColor"":null,""lineWidth"":2,""lineColor"":null,""enabled"":true}},""area"":{""lineWidth"":0,""marker"":{""enabled"":true}},""scatter"":{""marker"":{""fillColor"":null}},""bar"":{""stacking"":null},""column"":{""stacking"":null},""pie"":{""visible"":true,""dataLabels"":{""enabled"":true}}},""chart"":{""type"":""column"",""zoomType"":""none""},""subtitle"":{""text"":""% of U.S. adults who say abortion should be legal\/illegal, by religion (2019)""},""xAxis"":{""title"":[],""type"":""linear""},""yAxis"":{""title"":[],""max"":""100""},""misc"":{""inlineTooltips"":false},""html"":{""waypoints"":""true"",""data_tab"":""Data"",""chart_tab"":""Chart"",""share_tab"":""Share"",""height"":""450px"",""iframe"":true,""iframe_tab"":""Embed"",""iframe_text"":""Copy and paste the below iframe code into your own website to embed this chart."",""title"":""Views on abortion by religious affiliation"",""subtitle"":""% of U.S. adults who say abortion should be legal\/illegal, by religion (2019)"",""URL"":""https:\/\/www.pewforum.org\/chart\/views-on-abortion-by-religion\/"",""id"":23861,""slug"":""views-on-abortion-by-religion"",""domain"":""https:\/\/www.pewforum.org"",""credits"":"""",""creditsURL"":false,""creditText"":"" ""}}];",out/multi_col/data/27.csv,out/multi_col/imgs/27.png,"About three-quarters of white evangelical Protestants (77%) think abortion should be illegal in all or most cases.
By contrast, 83% of religiously unaffiliated Americans say abortion should be legal in all or most cases, as do nearly two-thirds of black Protestants (64%), six-in-ten white mainline Protestants (60%) and a slim majority of Catholics (56%).",bar,"['Religious Affiliation', 'Legal in all/most cases', 'Illegal in all/most cases']",https://www.pewforum.org/fact-sheet/public-opinion-on-abortion/,Religion & Public Life
28,"Views on abortion by party identification, 2019","% of U.S. adults who say abortion should be legal/illegal, by party identification (2019)",,"chart[23862] = [{""colors"":[""#0090c0"",""#c9deee"",""#9dc7e1"",""#0073a5"",""#00557e""],""plotOptions"":{""line"":{""marker"":{""fillColor"":null,""lineWidth"":2,""lineColor"":null,""enabled"":true}},""area"":{""lineWidth"":0,""marker"":{""enabled"":true}},""scatter"":{""marker"":{""fillColor"":null}},""bar"":{""stacking"":null},""column"":{""stacking"":null},""pie"":{""visible"":true,""dataLabels"":{""enabled"":true}}},""chart"":{""type"":""column"",""zoomType"":""none""},""subtitle"":{""text"":""% of U.S. adults who say abortion should be legal\/illegal, by party identification (2019)""},""xAxis"":{""title"":[],""type"":""linear""},""yAxis"":{""title"":[],""max"":""100""},""misc"":{""inlineTooltips"":false},""html"":{""waypoints"":""true"",""data_tab"":""Data"",""chart_tab"":""Chart"",""share_tab"":""Share"",""height"":""400px"",""iframe"":true,""iframe_tab"":""Embed"",""iframe_text"":""Copy and paste the below iframe code into your own website to embed this chart."",""title"":""Views on abortion by political party"",""subtitle"":""% of U.S. adults who say abortion should be legal\/illegal, by party identification (2019)"",""URL"":""https:\/\/www.pewforum.org\/chart\/views-on-abortion-by-party-identification\/"",""id"":23862,""slug"":""views-on-abortion-by-party-identification"",""domain"":""https:\/\/www.pewforum.org"",""credits"":"""",""creditsURL"":false,""creditText"":"" ""}}];",out/multi_col/data/28.csv,out/multi_col/imgs/28.png,"About six-in-ten Republicans and those who lean toward the Republican Party (62%) say abortion should be illegal in all or most cases. By contrast, 82% of Democrats and those who lean toward the Democratic Party say abortion should be legal in all or most cases.",bar,"['Party Identification', 'Legal in all/most cases', 'Illegal in all/most cases']",https://www.pewforum.org/fact-sheet/public-opinion-on-abortion/,Religion & Public Life
29,"Views on abortion by political party and ideology, 2019","% of U.S. adults who say abortion should be legal/illegal, by party ideology (2019)",,"chart[25283] = [{""colors"":[""#0090c0"",""#c9deee"",""#9dc7e1"",""#0073a5"",""#00557e""],""plotOptions"":{""line"":{""marker"":{""fillColor"":null,""lineWidth"":2,""lineColor"":null,""enabled"":true}},""area"":{""lineWidth"":0,""marker"":{""enabled"":true}},""scatter"":{""marker"":{""fillColor"":null}},""bar"":{""stacking"":null},""column"":{""stacking"":null},""pie"":{""visible"":true,""dataLabels"":{""enabled"":true}}},""chart"":{""type"":""column"",""zoomType"":""none""},""subtitle"":{""text"":""% of U.S. adults who say abortion should be legal\/illegal, by party ideology (2019)""},""xAxis"":{""title"":[],""type"":""linear""},""yAxis"":{""title"":[],""max"":""100""},""misc"":{""inlineTooltips"":false},""html"":{""waypoints"":""true"",""data_tab"":""Data"",""chart_tab"":""Chart"",""share_tab"":""Share"",""height"":""400px"",""iframe"":true,""iframe_tab"":""Embed"",""iframe_text"":""Copy and paste the below iframe code into your own website to embed this chart."",""title"":""Views on abortion by political ideology"",""subtitle"":""% of U.S. adults who say abortion should be legal\/illegal, by party ideology (2019)"",""URL"":""https:\/\/www.pewforum.org\/chart\/views-on-abortion-by-party-ideology\/"",""id"":25283,""slug"":""views-on-abortion-by-party-ideology"",""domain"":""https:\/\/www.pewforum.org"",""credits"":"""",""creditsURL"":false,""creditText"":"" ""}}];",out/multi_col/data/29.csv,out/multi_col/imgs/29.png,"Conservative Republicans and Republican leaners are far more likely to say abortion should be illegal in all or most cases than to say that it should be legal (77% vs. 22%). Among moderate and liberal Republicans, 57% say abortion should be legal, while 41% say it should be illegal.
The vast majority of liberal Democrats and Democratic leaners support legal abortion (91%), as do three-quarters of conservative and moderate Democrats (75%).",bar,"['Political party and ideology', 'Legal in all/most cases', 'Illegal in all/most cases']",https://www.pewforum.org/fact-sheet/public-opinion-on-abortion/,Religion & Public Life
30,"Views on abortion by gender, 2019","% of U.S. adults who say abortion should be legal/illegal, by gender (2019)",,"chart[23863] = [{""colors"":[""#0090c0"",""#c9deee"",""#9dc7e1"",""#0073a5"",""#00557e""],""plotOptions"":{""line"":{""marker"":{""fillColor"":null,""lineWidth"":2,""lineColor"":null,""enabled"":true}},""area"":{""lineWidth"":0,""marker"":{""enabled"":true}},""scatter"":{""marker"":{""fillColor"":null}},""bar"":{""stacking"":null},""column"":{""stacking"":null},""pie"":{""visible"":true,""dataLabels"":{""enabled"":true}}},""chart"":{""type"":""column"",""zoomType"":""none""},""subtitle"":{""text"":""% of U.S. adults who say abortion should be legal\/illegal, by gender (2019)""},""xAxis"":{""title"":[],""type"":""linear""},""yAxis"":{""title"":[],""max"":""100""},""misc"":{""inlineTooltips"":false},""html"":{""waypoints"":""true"",""data_tab"":""Data"",""chart_tab"":""Chart"",""share_tab"":""Share"",""height"":""400px"",""iframe"":true,""iframe_tab"":""Embed"",""iframe_text"":""Copy and paste the below iframe code into your own website to embed this chart."",""title"":""Views on abortion by gender"",""subtitle"":""% of U.S. adults who say abortion should be legal\/illegal, by gender (2019)"",""URL"":""https:\/\/www.pewforum.org\/chart\/views-on-abortion-by-gender\/"",""id"":23863,""slug"":""views-on-abortion-by-gender"",""domain"":""https:\/\/www.pewforum.org"",""credits"":"""",""creditsURL"":false,""creditText"":"" ""}}];",out/multi_col/data/30.csv,out/multi_col/imgs/30.png,"Men and women express similar views on abortion; 60% of women say it should be legal in all or most cases, as do 61% of men.",bar,"['Gender', 'Legal in all/most cases', 'Illegal in all/most cases']",https://www.pewforum.org/fact-sheet/public-opinion-on-abortion/,Religion & Public Life
31,"Views on abortion by age, 2019","% of U.S. adults who say abortion should be legal/illegal, by age (2019)",,"chart[23864] = [{""colors"":[""#0090c0"",""#c9deee"",""#9dc7e1"",""#0073a5"",""#00557e""],""plotOptions"":{""line"":{""marker"":{""fillColor"":null,""lineWidth"":2,""lineColor"":null,""enabled"":true}},""area"":{""lineWidth"":0,""marker"":{""enabled"":true}},""scatter"":{""marker"":{""fillColor"":null}},""bar"":{""stacking"":null},""column"":{""stacking"":null},""pie"":{""visible"":true,""dataLabels"":{""enabled"":true}}},""chart"":{""type"":""column"",""zoomType"":""none""},""subtitle"":{""text"":""% of U.S. adults who say abortion should be legal\/illegal, by age (2019)""},""xAxis"":{""title"":[],""type"":""linear""},""yAxis"":{""title"":[],""max"":""100""},""misc"":{""inlineTooltips"":false},""html"":{""waypoints"":""true"",""data_tab"":""Data"",""chart_tab"":""Chart"",""share_tab"":""Share"",""height"":""400px"",""iframe"":true,""iframe_tab"":""Embed"",""iframe_text"":""Copy and paste the below iframe code into your own website to embed this chart."",""title"":""Views on abortion by age"",""subtitle"":""% of U.S. adults who say abortion should be legal\/illegal, by age (2019)"",""URL"":""https:\/\/www.pewforum.org\/chart\/views-on-abortion-by-age\/"",""id"":23864,""slug"":""views-on-abortion-by-age"",""domain"":""https:\/\/www.pewforum.org"",""credits"":"""",""creditsURL"":false,""creditText"":"" ""}}];",out/multi_col/data/31.csv,out/multi_col/imgs/31.png,"Among adults under age 30, 70% say abortion should be legal in all or most cases, as do nearly two-thirds of adults in their 30s and 40s (64%). More than half of those in their 50s and early 60s (54%) and those ages 65 and older (55%) say the same.",bar,"['Age', 'Legal in all/most cases', 'Illegal in all/most cases']",https://www.pewforum.org/fact-sheet/public-opinion-on-abortion/,Religion & Public Life
32,"Views on abortion by level of education, 2019","% of U.S. adults who say abortion should be legal/illegal, by education level (2019)",,"chart[23865] = [{""colors"":[""#0090c0"",""#c9deee"",""#9dc7e1"",""#0073a5"",""#00557e""],""plotOptions"":{""line"":{""marker"":{""fillColor"":null,""lineWidth"":2,""lineColor"":null,""enabled"":true}},""area"":{""lineWidth"":0,""marker"":{""enabled"":true}},""scatter"":{""marker"":{""fillColor"":null}},""bar"":{""stacking"":null},""column"":{""stacking"":null},""pie"":{""visible"":true,""dataLabels"":{""enabled"":true}}},""chart"":{""type"":""column"",""zoomType"":""none""},""subtitle"":{""text"":""% of U.S. adults who say abortion should be legal\/illegal, by education level (2019)""},""xAxis"":{""title"":[],""type"":""linear""},""yAxis"":{""title"":[],""max"":""100""},""misc"":{""inlineTooltips"":false},""html"":{""waypoints"":""true"",""data_tab"":""Data"",""chart_tab"":""Chart"",""share_tab"":""Share"",""height"":""400px"",""iframe"":true,""iframe_tab"":""Embed"",""iframe_text"":""Copy and paste the below iframe code into your own website to embed this chart."",""title"":""Views on abortion by level of education"",""subtitle"":""% of U.S. adults who say abortion should be legal\/illegal, by education level (2019)"",""URL"":""https:\/\/www.pewforum.org\/chart\/views-on-abortion-by-education-level\/"",""id"":23865,""slug"":""views-on-abortion-by-education-level"",""domain"":""https:\/\/www.pewforum.org"",""credits"":"""",""creditsURL"":false,""creditText"":"" ""}}];",out/multi_col/data/32.csv,out/multi_col/imgs/32.png,"Seven-in-ten college graduates (70%) say abortion should be legal in all or most cases, as do 60% of those with some college education. A slim majority of those with a high school degree or less education share this opinion: 54% say abortion should be legal in all or most cases, while 44% say it should be illegal in all or most cases.",bar,"['Level of Education', 'Legal in all/most cases', 'Illegal in all/most cases']",https://www.pewforum.org/fact-sheet/public-opinion-on-abortion/,Religion & Public Life
33,Monthly sessions on NPR apps,Average number of completed monthly sessions by device and app,"Note: Data for NPR News: iPhone unavailable for 2018. The NPR One app launched on July 28, 2014, thus data are not available for 2014. 2014 sessions for the NPR News app on iPhone are based on an estimate for April 9-May 2. There is no NPR One app specifically for iPads. A completed session is any instance in which a user starts and stops using the app.
Source: NPR, based on Google Analytics data for January-December and iPhone News App data from January-August of each year.","chart[63713] = [{""colors"":[""#733D47"",""#BC7B86"",""#D1A8AF"",""#E8D3D7"",""#552E35""],""plotOptions"":{""line"":{""marker"":{""fillColor"":null,""lineWidth"":2,""lineColor"":null,""enabled"":true}},""area"":{""lineWidth"":0,""marker"":{""enabled"":true}},""scatter"":{""marker"":{""fillColor"":null}},""bar"":{""stacking"":null},""column"":{""stacking"":null},""pie"":{""visible"":true,""dataLabels"":{""enabled"":true}}},""chart"":{""type"":""column"",""zoomType"":""none""},""subtitle"":{""text"":""Average number of completed monthly sessions by device and app""},""xAxis"":{""title"":[],""type"":""linear""},""yAxis"":{""title"":[]},""misc"":{""inlineTooltips"":false},""html"":{""waypoints"":false,""data_tab"":""Data"",""chart_tab"":""Chart"",""share_tab"":""Share"",""height"":""400px"",""iframe"":true,""iframe_tab"":""Embed"",""iframe_text"":""Copy and paste the below iframe code into your own website to embed this chart."",""title"":""Monthly sessions on NPR apps"",""subtitle"":""Average number of completed monthly sessions by device and app"",""URL"":""https:\/\/www.journalism.org\/chart\/sotnm-public-media-monthly-sessions-on-npr-apps\/"",""id"":63713,""slug"":""sotnm-public-media-monthly-sessions-on-npr-apps"",""domain"":""https:\/\/www.journalism.org"",""credits"":""Note: Data for NPR News: iPhone unavailable for 2018. The NPR One app launched on July 28, 2014, thus data are not available for 2014. 2014 sessions for the NPR News app on iPhone are based on an estimate for April 9-May 2. There is no NPR One app specifically for iPads. A completed session is any instance in which a user starts and stops using the app.<br> Source: NPR, based on Google Analytics data for January-December and iPhone News App data from January-August of each year."",""creditsURL"":false,""creditText"":"" ""}}];",out/multi_col/data/33.csv,out/multi_col/imgs/33.png,"NPR’s digital platforms continue to be an important part of its reach. The NPR One app, which offers a stream of individual shows and podcasts, had a similar or slightly higher average number of total completed sessions in 2018 as in 2017, depending upon the device. (A completed session is any instance in which a user starts and stops using the app.) The NPR News app, which offers livestreams from individual stations and digital content, declined in completed sessions among Android and iPad users. (Data for the NPR News iPhone app is unavailable for 2018.)",bar,"['App', '2014', '2015', '2016', '2017', '2018']",https://www.journalism.org/fact-sheet/public-broadcasting/,Journalism & Media
34,Individual giving and underwriting revenue for local public radio news stations,Revenue for the 123 largest news-oriented public radio licensees (in U.S. dollars),"Note: All figures are fiscal year, inflation-adjusted calculations. Data for these licensees was aggregated and provided by Mark Fuerst, director of consultancy, Public Media Futures Forum, using the Annual Financial Reports submitted by each licensee to the Corporation for Public Broadcasting (CPB). These results reflect the performance of the largest public radio news-station licensees initially selected in 2015 and thereafter tracked by Public Media Futures to estimate total system performance. One licensee was dropped from the analysis due to a format change, bringing the total to 123 (118 licensees plus five owners of 11 licensees). Previous years' data was updated to reflect this new cohort.
Source: Public Media Futures Forum, a project funded by the Wyncote Foundation.","chart[63724] = [{""colors"":[""#733D47"",""#BC7B86"",""#D1A8AF"",""#E8D3D7"",""#552E35""],""plotOptions"":{""line"":{""marker"":{""fillColor"":null,""lineWidth"":2,""lineColor"":null,""enabled"":true}},""area"":{""lineWidth"":0,""marker"":{""enabled"":true}},""scatter"":{""marker"":{""fillColor"":null}},""bar"":{""stacking"":null},""column"":{""stacking"":null},""pie"":{""visible"":true,""dataLabels"":{""enabled"":true}}},""chart"":{""type"":""line"",""zoomType"":""none""},""subtitle"":{""text"":""Revenue for the 123 largest news-oriented public radio licensees (in U.S. dollars)""},""xAxis"":{""title"":[],""type"":""datetime""},""yAxis"":{""title"":[],""max"":""1000000000""},""misc"":{""inlineTooltips"":false},""html"":{""waypoints"":false,""data_tab"":""Data"",""chart_tab"":""Chart"",""share_tab"":""Share"",""height"":""400px"",""iframe"":true,""iframe_tab"":""Embed"",""iframe_text"":""Copy and paste the below iframe code into your own website to embed this chart."",""title"":""Individual giving and underwriting revenue for local public radio news stations"",""subtitle"":""Revenue for the 123 largest news-oriented public radio licensees (in U.S. dollars)"",""URL"":""https:\/\/www.journalism.org\/chart\/sotnm-public-media-individual-giving-and-underwriting-revenue-for-local-public-radio-stations\/"",""id"":63724,""slug"":""sotnm-public-media-individual-giving-and-underwriting-revenue-for-local-public-radio-stations"",""domain"":""https:\/\/www.journalism.org"",""credits"":""Note: All figures are fiscal year, inflation-adjusted calculations. Data for these licensees was aggregated and provided by Mark Fuerst, director of consultancy, Public Media Futures Forum, using the Annual Financial Reports submitted by each licensee to the Corporation for Public Broadcasting (CPB). These results reflect the performance of the largest public radio news-station licensees initially selected in 2015 and thereafter tracked by Public Media Futures to estimate total system performance. One licensee was dropped from the analysis due to a format change, bringing the total to 123 (118 licensees plus five owners of 11 licensees). Previous years' data was updated to reflect this new cohort.<br> Source: Public Media Futures Forum, a project funded by the Wyncote Foundation."",""creditsURL"":false,""creditText"":"" ""}}];",out/multi_col/data/34.csv,out/multi_col/imgs/34.png,"This revenue for local public radio comes from a range of streams, but individual giving (which includes member revenue and major gifts) and underwriting (from businesses and foundations as well as other nonprofit organizations) are two key sources of funding. Among the 123 news-oriented licensees studied here, individual giving and underwriting accounted for a combined $595.5 million in revenue in 2017.",line,"['Year', 'Individual giving', 'Underwriting']",https://www.journalism.org/fact-sheet/public-broadcasting/,Journalism & Media
