id,title,subtitle,credits,script,dataPath,imgPath,caption,chartType,columns,URL,topic
68,"Hispanic population, by nativity","Population estimates, in millions","Source: For 1960 and 1970, see Passel and Cohn’s 2008 population projections. For 1980-2000, Pew Research Center analysis of U.S. decennial census data (5% IPUMS). For 2006-2015, Pew Research Center analysis of American Community Survey (1% IPUMS).","chart[22141] = [{""colors"":[""#A55A26"",""#DE996A"",""#E7BA9A"",""#F2DBCD"",""#7C441C""],""plotOptions"":{""line"":{""marker"":{""lineWidth"":2,""lineColor"":null,""enabled"":false},""stacking"":""normal""},""area"":{""lineWidth"":0,""marker"":{""enabled"":false},""stacking"":""normal""},""scatter"":{""marker"":{""fillColor"":null}},""bar"":{""stacking"":""normal""},""column"":{""stacking"":""normal""},""pie"":{""visible"":true,""dataLabels"":{""enabled"":true}}},""chart"":{""type"":""area"",""zoomType"":""none""},""subtitle"":{""text"":""Population estimates, in millions""},""xAxis"":{""title"":[],""type"":""datetime""},""yAxis"":{""title"":[]},""misc"":{""inlineTooltips"":false},""html"":{""waypoints"":false,""data_tab"":""Data"",""chart_tab"":""Chart"",""share_tab"":""Share"",""height"":""400px"",""iframe"":""true"",""iframe_tab"":""Embed"",""iframe_text"":""Copy and paste the below iframe code into your own website to embed this chart."",""title"":""Hispanic population, by nativity"",""subtitle"":""Population estimates, in millions"",""URL"":""https:\/\/www.pewresearch.org\/hispanic\/chart\/hispanic-population-by-nativity\/"",""id"":22141,""slug"":""hispanic-population-by-nativity"",""domain"":""https:\/\/www.pewresearch.org\/hispanic"",""credits"":"""",""creditsURL"":false,""creditText"":"" ""}}];",out/multi_col/data/68.csv,out/multi_col/imgs/68.png,"Since 1960, the nation’s Latino population has increased nearly ninefold, from 6.3 million then to 56.5 million by 2015. It is projected to grow to 107 million by 2065, according to the latest Pew Research Center projections. The foreign-born Latino population has increased to nearly 20 times its size over the past half century, from less than 1 million in 1960 to 19.4 million in 2015. On the other hand, while the U.S.-born Latino population has only increased sixfold over this time period, there are about 32 million more U.S.-born Latinos in the U.S. today (37.1 million) than there were in 1960 (5.5 million).",area,"['Year', 'U.S. born', 'Foreign born']",https://www.pewresearch.org/hispanic/2017/09/18/2015-statistical-information-on-hispanics-in-united-states/,Hispanic Trends
69,Hispanics are a rising share of the U.S. population,% of total population,"Note: In 1960-1970, Asians include Pacific Islanders.
Source: For 1960 and 1970, see Passel and Cohn’s 2008 population projections. For 1980-2000, Pew Research Center analysis of U.S. decennial census data (5% IPUMS). For 2006-2014, Pew Research Center analysis of American Community Survey (1% IPUMS).","chart[22142] = [{""colors"":[""#A55A26"",""#DE996A"",""#E7BA9A"",""#F2DBCD"",""#7C441C""],""plotOptions"":{""line"":{""marker"":{""lineWidth"":2,""lineColor"":null,""enabled"":false},""stacking"":""normal""},""area"":{""lineWidth"":0,""marker"":{""enabled"":false},""stacking"":""normal""},""scatter"":{""marker"":{""fillColor"":null}},""bar"":{""stacking"":""normal""},""column"":{""stacking"":""normal""},""pie"":{""visible"":true,""dataLabels"":{""enabled"":true}}},""chart"":{""type"":""area"",""zoomType"":""none""},""subtitle"":{""text"":""% of total population""},""xAxis"":{""title"":[],""type"":""datetime""},""yAxis"":{""title"":[],""max"":102,""tickInterval"":17},""misc"":{""inlineTooltips"":false},""html"":{""waypoints"":false,""data_tab"":""Data"",""chart_tab"":""Chart"",""share_tab"":""Share"",""height"":""400px"",""iframe"":""true"",""iframe_tab"":""Embed"",""iframe_text"":""Copy and paste the below iframe code into your own website to embed this chart."",""title"":""Hispanics are a rising share of the U.S. population"",""subtitle"":""% of total population"",""URL"":""https:\/\/www.pewresearch.org\/hispanic\/chart\/hispanics-are-a-rising-share-of-the-u-s-population\/"",""id"":22142,""slug"":""hispanics-are-a-rising-share-of-the-u-s-population"",""domain"":""https:\/\/www.pewresearch.org\/hispanic"",""credits"":"""",""creditsURL"":false,""creditText"":"" ""}}];",out/multi_col/data/69.csv,out/multi_col/imgs/69.png,"The share of the U.S. population that is Hispanic has been steadily rising over the past half century. In 2015, Hispanics made up 17.6% of the total U.S. population, up from 3.5% in 1960. According to the latest Pew Research Center projections, the Hispanic share of the U.S. population is expected to reach 24% by 2065.",area,"['Year', 'White', 'Other', 'Asian', 'Black', 'Hispanic']",https://www.pewresearch.org/hispanic/2017/09/18/2015-statistical-information-on-hispanics-in-united-states/,Hispanic Trends
70,Foreign-born share declining among Hispanics,% foreign born,"Source: For 1960 and 1970, see Passel and Cohn’s 2008 population projections. For 1980-2000, Pew Research Center analysis of U.S. decennial census data (5% IPUMS). For 2006-2015, Pew Research Center analysis of American Community Survey (1% IPUMS).","chart[22143] = [{""colors"":[""#A55A26"",""#DE996A"",""#E7BA9A"",""#F2DBCD"",""#7C441C""],""plotOptions"":{""line"":{""marker"":{""lineWidth"":2,""lineColor"":null,""enabled"":false}},""area"":{""lineWidth"":0,""marker"":{""enabled"":false}},""scatter"":{""marker"":{""fillColor"":null}},""bar"":{""stacking"":null},""column"":{""stacking"":null},""pie"":{""visible"":true,""dataLabels"":{""enabled"":true}}},""chart"":{""type"":""line"",""zoomType"":""none""},""subtitle"":{""text"":""% foreign born""},""xAxis"":{""title"":[],""type"":""datetime""},""yAxis"":{""title"":[],""max"":""60""},""misc"":{""inlineTooltips"":false},""html"":{""waypoints"":false,""data_tab"":""Data"",""chart_tab"":""Chart"",""share_tab"":""Share"",""height"":""400px"",""iframe"":""true"",""iframe_tab"":""Embed"",""iframe_text"":""Copy and paste the below iframe code into your own website to embed this chart."",""title"":""Foreign-born share declining among Hispanics"",""subtitle"":""% foreign born"",""URL"":""https:\/\/www.pewresearch.org\/hispanic\/chart\/share-foreign-born-among-hispanics\/"",""id"":22143,""slug"":""share-foreign-born-among-hispanics"",""domain"":""https:\/\/www.pewresearch.org\/hispanic"",""credits"":"""",""creditsURL"":false,""creditText"":"" ""}}];",out/multi_col/data/70.csv,out/multi_col/imgs/70.png,"After increasing for at least four decades, the share of the Hispanic population that is foreign born began declining after 2000. Among all Hispanics, the share that was born in another country was 34.4% in 2015, down from a peak of about 40% earlier in the 2000s. The share of adult Hispanics who are foreign born began declining a bit later – 47.9% of Hispanic adults were born in another country in 2015, down from a peak of 55.0% in 2007.",line,"['Year', 'All Hispanics', 'Adult Hispanics']",https://www.pewresearch.org/hispanic/2017/09/18/2015-statistical-information-on-hispanics-in-united-states/,Hispanic Trends
71,Mexican-origin share among U.S. Hispanics declining,% among Hispanics,"Source: For 1850-2000, Pew Research Center analysis of U.S. decennial census data (5% IPUMS). For 2006-2015, Pew Research Center analysis of American Community Survey (1% IPUMS).
","chart[22144] = [{""colors"":[""#A55A26"",""#DE996A"",""#E7BA9A"",""#F2DBCD"",""#7C441C""],""plotOptions"":{""line"":{""marker"":{""lineWidth"":2,""lineColor"":null,""enabled"":false}},""area"":{""lineWidth"":0,""marker"":{""enabled"":false}},""scatter"":{""marker"":{""fillColor"":null}},""bar"":{""stacking"":null},""column"":{""stacking"":null},""pie"":{""visible"":true,""dataLabels"":{""enabled"":true}}},""chart"":{""type"":""line"",""zoomType"":""none""},""subtitle"":{""text"":""% among Hispanics""},""xAxis"":{""title"":[],""type"":""datetime""},""yAxis"":{""title"":[],""max"":""100""},""misc"":{""inlineTooltips"":false},""html"":{""waypoints"":false,""data_tab"":""Data"",""chart_tab"":""Chart"",""share_tab"":""Share"",""height"":""400px"",""iframe"":""true"",""iframe_tab"":""Embed"",""iframe_text"":""Copy and paste the below iframe code into your own website to embed this chart."",""title"":""Mexican-origin share among U.S. Hispanics declining"",""subtitle"":""% among Hispanics"",""URL"":""https:\/\/www.pewresearch.org\/hispanic\/chart\/share-mexican-origin-among-the-u-s-hispanic-population\/"",""id"":22144,""slug"":""share-mexican-origin-among-the-u-s-hispanic-population"",""domain"":""https:\/\/www.pewresearch.org\/hispanic"",""credits"":""Source: For 1850-2000, Pew Research Center analysis of U.S. decennial  census data (5% IPUMS). For 2006-2015, Pew Research Center analysis of American Community Survey (1% IPUMS)."",""creditsURL"":false,""creditText"":"" ""}}];",out/multi_col/data/71.csv,out/multi_col/imgs/71.png,"Mexican-origin Hispanics have always been the largest Hispanic-origin group in the U.S. In 1860, for example, among the 155,000 Hispanics living in the U.S., 81.1% were of Mexican origin – a historic high. Since then the origins of the nation’s Hispanic population have diversified as growing numbers of immigrants from other Latin American nations and Puerto Rico settled in the U.S. For example, between 1930 and 1980, Hispanics from places other than Mexico nearly doubled their representation among U.S. Hispanics, from 22.4% to 40.6%. But with the arrival of large numbers of Mexican immigrants in the 1980s and 1990s, the Mexican share among Hispanics grew, rising to a recent peak of 65.7% in 2008, but declining since.",line,"['Year', 'Mexican origin', 'Non-Mexican Hispanics']",https://www.pewresearch.org/hispanic/2017/09/18/2015-statistical-information-on-hispanics-in-united-states/,Hispanic Trends
72,"Sources of Hispanic population growth, by decade",In millions,"Notes: U.S. births and immigrations reflect additions to the U.S. Hispanic population. Deaths and emigration not shown.
Source: Based on Pew Research Center tabulations of 2015 American Community Survey (1% IPUMS) for 2010-2015, and of the 2010 American Community Survey (1% IPUMS) for 2000s. Data for 1970s, 1980s and 1990s drawn from Pew Research Center historical projections (Passel and Cohn, 2008).","chart[22146] = [{""colors"":[""#A55A26"",""#DE996A"",""#E7BA9A"",""#F2DBCD"",""#7C441C""],""plotOptions"":{""line"":{""marker"":{""lineWidth"":2,""lineColor"":null,""enabled"":true}},""area"":{""lineWidth"":0,""marker"":{""enabled"":true}},""scatter"":{""marker"":{""fillColor"":null}},""bar"":{""stacking"":null},""column"":{""stacking"":null},""pie"":{""visible"":true,""dataLabels"":{""enabled"":true}}},""chart"":{""type"":""column"",""zoomType"":""none""},""subtitle"":{""text"":""In millions""},""xAxis"":{""title"":[],""type"":""linear""},""yAxis"":{""title"":[],""max"":""12.0""},""misc"":{""inlineTooltips"":false},""html"":{""waypoints"":false,""data_tab"":""Data"",""chart_tab"":""Chart"",""share_tab"":""Share"",""height"":""400px"",""iframe"":""true"",""iframe_tab"":""Embed"",""iframe_text"":""Copy and paste the below iframe code into your own website to embed this chart."",""title"":""Sources of Hispanic population growth, by decade"",""subtitle"":""In millions"",""URL"":""https:\/\/www.pewresearch.org\/hispanic\/chart\/sources-of-hispanic-population-growth-by-decade\/"",""id"":22146,""slug"":""sources-of-hispanic-population-growth-by-decade"",""domain"":""https:\/\/www.pewresearch.org\/hispanic"",""credits"":""Notes: U.S. births and immigrations reflect additions to the U.S. Hispanic population. Deaths and emigration not shown.<\/br>Source: Based on Pew Research Center tabulations of 2015 American Community Survey (1% IPUMS) for 2010-2015, and of the 2010 American Community Survey (1% IPUMS) for 2000s. Data for 1970s, 1980s and 1990s drawn from Pew Research Center historical projections (Passel and Cohn, 2008)."",""creditsURL"":false,""creditText"":"" ""}}];",out/multi_col/data/72.csv,out/multi_col/imgs/72.png,"Between 1980 and 2000, immigration was the principal driver of Latino population growth as the Latino immigrant population boomed from 4.2 million to 14.1 million. Since then, however, the primary source of this growth has been U.S. births. Between 2000 and 2010, there were 9.6 million Latino births in the U.S., while the number of newly arrived immigrants was 6.5 million. The present decade is on track to repeat this pattern, with 5 million Latino births in the U.S. between 2010 and 2015, compared with just 1.9 million newly arrived Latino immigrants.",bar,"['Date', 'U.S. births', 'Immigration']",https://www.pewresearch.org/hispanic/2017/09/18/2015-statistical-information-on-hispanics-in-united-states/,Hispanic Trends
73,English proficiency among Hispanics,"% of Hispanics ages 5 and older who speak only English at home or who speak English at least ""very well""","Note: Respondents are asked if they speak a language besides English at home. If they answer yes, they are asked how well they speak English.
Source: Pew Research Center tabulations of 1980, 1990 and 2000 censuses (5% IPUMS) and 2010, 2013, 2014 and 2015 American Community Surveys (1% IPUMS).","chart[22145] = [{""colors"":[""#A55A26"",""#DE996A"",""#E7BA9A"",""#F2DBCD"",""#7C441C""],""plotOptions"":{""line"":{""marker"":{""lineWidth"":2,""lineColor"":null,""enabled"":false}},""area"":{""lineWidth"":0,""marker"":{""enabled"":false}},""scatter"":{""marker"":{""fillColor"":null}},""bar"":{""stacking"":null},""column"":{""stacking"":null},""pie"":{""visible"":true,""dataLabels"":{""enabled"":true}}},""chart"":{""type"":""line"",""zoomType"":""none""},""subtitle"":{""text"":""% of Hispanics ages 5 and older who speak only English at home or who speak English at least \""very well\""""},""xAxis"":{""title"":[],""type"":""linear""},""yAxis"":{""title"":[]},""misc"":{""inlineTooltips"":false},""html"":{""waypoints"":false,""data_tab"":""Data"",""chart_tab"":""Chart"",""share_tab"":""Share"",""height"":""400px"",""iframe"":""true"",""iframe_tab"":""Embed"",""iframe_text"":""Copy and paste the below iframe code into your own website to embed this chart."",""title"":""English proficiency among Hispanics"",""subtitle"":""% of Hispanics ages 5 and older who speak only English at home or who speak English at least \""very well\"""",""URL"":""https:\/\/www.pewresearch.org\/hispanic\/chart\/english-proficiency-among-hispanics\/"",""id"":22145,""slug"":""english-proficiency-among-hispanics"",""domain"":""https:\/\/www.pewresearch.org\/hispanic"",""credits"":""Note: Respondents are asked if they speak a language besides English at home. If they answer yes, they are asked how well they speak English.<\/br>Source: Pew Research Center tabulations of 1980, 1990 and 2000 censuses (5% IPUMS) and  2010, 2013, 2014 and 2015 American Community Surveys (1% IPUMS)."",""creditsURL"":false,""creditText"":"" ""}}];",out/multi_col/data/73.csv,out/multi_col/imgs/73.png,"English proficiency is rising among Hispanics ages 5 and older. In 2015, 69% of Hispanics said they speak only English at home or indicate that they speak English “very well”, up from 59% who said the same in 1980. Most of this growth has been driven by U.S.-born Hispanics, whose English proficiency share has grown from 71.9% in 1980 to 89.7% in 2015. By contrast, English proficiency among foreign-born Hispanics has seen little change over the same period. In 2015, just 34.6% of foreign-born Hispanics reported that they speak only English at home or speak English “very well”, a slight increase from 30.7% in 1980.",line,"['Year', 'U.S. born', 'Foreign born', 'All Hispanics']",https://www.pewresearch.org/hispanic/2017/09/18/2015-statistical-information-on-hispanics-in-united-states/,Hispanic Trends
154,Public trust in government near historic lows,,,"chart[320660] = [{""chart"":{""type"":""line"",""zoomType"":""xy""},""subtitle"":[],""xAxis"":{""title"":[],""type"":""datetime"",""plotBands"":[{""color"":""#F5F4EF"",""from"":-978307200000,""to"":-780278400000,""label"":{""text"":""Roosevelt"",""rotation"":-90,""verticalAlign"":""bottom"",""y"":-12,""textAlign"":""left"",""style"":{""color"":""#456A83""}}},{""color"":""#FFFFFF"",""from"":-780192000000,""to"":-534902400000,""label"":{""text"":""Truman"",""rotation"":-90,""verticalAlign"":""bottom"",""y"":-12,""textAlign"":""left"",""style"":{""color"":""#456A83""}}},{""color"":""#F5F4EF"",""from"":-534816000000,""to"":-282441600000,""label"":{""text"":""Eisenhower"",""rotation"":-90,""verticalAlign"":""bottom"",""y"":-12,""textAlign"":""left"",""style"":{""color"":""#BF3B27""}}},{""color"":""#FFFFFF"",""from"":-282355200000,""to"":-192931200000,""label"":{""text"":""Kennedy"",""rotation"":-90,""verticalAlign"":""bottom"",""y"":-12,""textAlign"":""left"",""style"":{""color"":""#456A83""}}},{""color"":""#F5F4EF"",""from"":-192844800000,""to"":-29980800000,""label"":{""text"":""Johnson"",""rotation"":-90,""verticalAlign"":""bottom"",""y"":-12,""textAlign"":""left"",""style"":{""color"":""#456A83""}}},{""color"":""#FFFFFF"",""from"":-29894400000,""to"":145152000000,""label"":{""text"":""Nixon"",""rotation"":-90,""verticalAlign"":""top"",""textAlign"":""right"",""style"":{""color"":""#BF3B27""}}},{""color"":""#F5F4EF"",""from"":145238400000,""to"":222480000000,""label"":{""text"":""Ford"",""rotation"":-90,""verticalAlign"":""top"",""textAlign"":""right"",""style"":{""color"":""#BF3B27""}}},{""color"":""#FFFFFF"",""from"":222566400000,""to"":348710400000,""label"":{""text"":""Carter"",""rotation"":-90,""verticalAlign"":""top"",""textAlign"":""right"",""style"":{""color"":""#456A83""}}},{""color"":""#F5F4EF"",""from"":348796800000,""to"":601171200000,""label"":{""text"":""Reagan"",""rotation"":-90,""verticalAlign"":""top"",""textAlign"":""right"",""style"":{""color"":""#BF3B27""}}},{""color"":""#FFFFFF"",""from"":601257600000,""to"":727401600000,""label"":{""text"":""Bush"",""rotation"":-90,""verticalAlign"":""top"",""textAlign"":""right"",""style"":{""color"":""#BF3B27""}}},{""color"":""#F5F4EF"",""from"":727488000000,""to"":979862400000,""label"":{""text"":""Clinton"",""rotation"":-90,""verticalAlign"":""top"",""textAlign"":""right"",""style"":{""color"":""#456A83""}}},{""color"":""#FFFFFF"",""from"":979948800000,""to"":1232323200000,""label"":{""text"":""G.W. Bush"",""rotation"":-90,""verticalAlign"":""top"",""textAlign"":""right"",""style"":{""color"":""#BF3B27""}}},{""color"":""#F5F4EF"",""from"":1232409600000,""to"":1484937155000,""label"":{""text"":""Obama"",""rotation"":-90,""verticalAlign"":""top"",""textAlign"":""right"",""style"":{""color"":""#456A83""}}},{""color"":""#FFFFFF"",""from"":1484937155000,""to"":1514741042000,""label"":{""text"":""Trump"",""rotation"":-90,""x"":9,""verticalAlign"":""top"",""textAlign"":""right"",""style"":{""color"":""#BF3B27""}}}],""labels"":{""format"":""{value:%Y}""},""lineColor"":""darkgray"",""tickWidth"":1,""tickColor"":""darkgray"",""tickLength"":8},""yAxis"":{""title"":[]},""plotOptions"":{""line"":{""marker"":{""enabled"":true}},""area"":{""marker"":{""enabled"":true}},""bar"":{""stacking"":null},""column"":{""stacking"":null},""pie"":{""visible"":true,""dataLabels"":{""enabled"":true}},""series"":{""connectNulls"":false,""lineWidth"":2.5,""enableMouseTracking"":true,""marker"":{""enabled"":false}}},""misc"":{""inlineTooltips"":false},""html"":{""waypoints"":""true"",""data_tab"":""Data"",""chart_tab"":""Chart"",""share_tab"":""Share"",""height"":""400px"",""iframe"":"""",""iframe_tab"":""Embed"",""iframe_text"":""Copy and paste the below iframe code into your own website to embed this chart."",""title"":""Public trust in government near historic lows"",""subtitle"":"""",""URL"":""https:\/\/www.pewresearch.org\/chart\/public-trust-in-government-near-historic-lows\/"",""id"":320660,""slug"":""public-trust-in-government-near-historic-lows"",""domain"":""https:\/\/www.pewresearch.org"",""credits"":"""",""creditsURL"":false,""creditText"":"" ""},""legend"":{""itemStyle"":{""fontWeight"":""normal""},""reversed"":""true""},""credits"":{""enabled"":""true"",""text"":""click legend items to remove them from chart"",""href"":""javascript:void(0)"",""position"":{""align"":""center"",""x"":10,""y"":-13},""style"":{""color"":""#000000"",""cursor"":""auto"",""fontSize"":""12px"",""fontWeight"":""bold"",""font-variant"":""small-caps""}},""tooltip"":{""xDateFormat"":""%b %Y""}}];",out/multi_col/data/154.csv,out/multi_col/imgs/154.png,"Might 2016 be the year we break the fever? So far it’s not looking that way. The public remains in a foul mood, frustrated by stagnant incomes, a shrinking middle class and gruesome global terrorism. Just 19% say they trust the government to do what’s right. Moreover, most Republicans and many Democrats say they believe that, on the issues that matter most to them, the other side is winning. And not since the early 2000s has a majority of the public said the nation is on the right track, making these past dozen years the longest sustained stretch of national pessimism since the onset of polling.",line,"['Date', '.', 'Individual polls', 'Moving average']",https://www.pewresearch.org/fact-tank/2016/01/27/the-demographic-trends-shaping-american-politics-in-2016-and-beyond/,U.S. Politics & Policy
156,Social Networking Use Has Shot Up in Past Decade,% of all American adults and internet-using adults who use at least one social networking site,"Source: Pew Research Center surveys, 2005-2006, 2008-2015. No data are available for 2007.","chart[14735] = [{""colors"":[""#002748 "",""#7591b7 "",""#c9d1e1 "",""#949d48 "",""#002748""],""plotOptions"":{""line"":{""marker"":{""fillColor"":null,""lineWidth"":2,""lineColor"":null,""enabled"":true}},""area"":{""lineWidth"":0,""marker"":{""enabled"":true}},""scatter"":{""marker"":{""fillColor"":null}},""bar"":{""stacking"":null},""column"":{""stacking"":null},""pie"":{""visible"":true,""dataLabels"":{""enabled"":true}}},""chart"":{""type"":""line""},""subtitle"":{""text"":""% of all American adults and internet-using adults who use at least one social networking site""},""xAxis"":{""title"":[],""type"":""datetime""},""yAxis"":{""title"":[]},""misc"":{""inlineTooltips"":false},""html"":{""waypoints"":false,""data_tab"":""Data"",""chart_tab"":""Chart"",""share_tab"":""Share"",""height"":""400px"",""iframe"":""true"",""iframe_tab"":""Embed"",""iframe_text"":""Copy and paste the below iframe code into your own website to embed this chart."",""title"":""Social Networking Use Has Shot Up in Past Decade"",""subtitle"":""% of all American adults and internet-using adults who use at least one social networking site"",""URL"":""https:\/\/www.pewresearch.org\/internet\/chart\/social-networking-use-has-shot-up-in-past-decade\/"",""id"":14735,""slug"":""social-networking-use-has-shot-up-in-past-decade"",""domain"":""https:\/\/www.pewresearch.org\/internet"",""credits"":"""",""creditsURL"":false,""creditText"":"" ""}}];",out/multi_col/data/156.csv,out/multi_col/imgs/156.png,"Nearly two-thirds of American adults (65%) use social networking sites, up from 7% when Pew Research Center began systematically tracking social media usage in 2005. Pew Research reports have documented in great detail how the rise of social media has affected such things as work, politics and political deliberation, communications patterns around the globe, as well as the way people get and share information about health, civic life, news consumption, communities, teenage life, parenting, dating and even people’s level of stress.
A special analysis of 27 national surveys of Americans across the past decade documents this substantial spread of technology throughout the population, although the overall number of users of social networking sites has leveled off since 2013.1 At the same time, there continues to be growth in social media usage among some groups that were not among the earliest adopters, including older Americans.",line,"['Year', 'Internet Users', 'All Adults']",https://www.pewresearch.org/internet/2015/10/08/social-networking-usage-2005-2015/,Internet & Technology
