id,title,subtitle,credits,script,dataPath,imgPath,caption,chartType,columns,URL,topic
1,"In 2019, child poverty rates had dropped among all major racial and ethnic groups","% of children living in poverty, by race and ethnicity","Note: Children include those who are younger than 18. White children include only those who report being one race and are not Hispanic. In 2001 and earlier, Asian Americans included Pacific Islanders. Data on Asian Americans not available prior to 1987. From 2002-2019, respondents could choose more than one race; White, Black and Asian children include only the single-race components of their populations in these years. Hispanics are of any race.
Source: U.S. Census Bureau historical poverty data, 1976-2019.","chart[380520] = [{""chart"":{""type"":""line"",""zoomType"":""none""},""subtitle"":{""text"":""% of children living in poverty, by race and ethnicity ""},""xAxis"":{""title"":[],""type"":""datetime"",""plotBands"":[{""color"":""#F5F4EF"",""from"":315532800000,""to"":331257600000,""label"":{""text"":"""",""verticalAlign"":""top"",""textAlign"":""center"",""style"":{""color"":""#6D6F71""}}},{""color"":""#F5F4EF"",""from"":362793600000,""to"":404956800000,""label"":{""text"":"""",""verticalAlign"":""bottom"",""y"":-12,""textAlign"":""left"",""style"":{""color"":""#6D6F71""}}},{""color"":""#F5F4EF"",""from"":646790400000,""to"":667785600000,""label"":{""text"":"""",""verticalAlign"":""bottom"",""y"":-12,""textAlign"":""left"",""style"":{""color"":""#6D6F71""}}},{""color"":""#F5F4EF"",""from"":983404800000,""to"":1004572800000,""label"":{""text"":"""",""verticalAlign"":""bottom"",""y"":-12,""textAlign"":""left"",""style"":{""color"":""#6D6F71""}}},{""color"":""#F5F4EF"",""from"":1196485200000,""to"":1243828800000,""label"":{""text"":""RECESSIONS"",""verticalAlign"":""top"",""textAlign"":""center"",""style"":{""color"":""#6D6F71""}}}],""labels"":{""format"":""{value:%Y}""},""lineColor"":""darkgray"",""tickWidth"":1,""tickColor"":""darkgray"",""tickLength"":8},""yAxis"":{""title"":[]},""plotOptions"":{""line"":{""marker"":{""enabled"":false}},""area"":{""marker"":{""enabled"":false}},""bar"":{""stacking"":null},""column"":{""stacking"":null},""pie"":{""visible"":true,""dataLabels"":{""enabled"":true}},""series"":{""connectNulls"":false,""lineWidth"":3.5,""enableMouseTracking"":true,""marker"":{""enabled"":false}}},""misc"":{""inlineTooltips"":false},""html"":{""waypoints"":""true"",""data_tab"":""Data"",""chart_tab"":""Chart"",""share_tab"":""Share"",""height"":""400px"",""iframe"":""true"",""iframe_tab"":""Embed"",""iframe_text"":""Copy and paste the below iframe code into your own website to embed this chart."",""title"":""In 2019, child poverty rates had dropped among all major racial and ethnic groups"",""subtitle"":""% of children living in poverty, by race and ethnicity "",""URL"":""https:\/\/www.pewresearch.org\/chart\/in-2019-child-poverty-rates-had-dropped-among-all-major-racial-and-ethnic-groups\/"",""id"":380520,""slug"":""in-2019-child-poverty-rates-had-dropped-among-all-major-racial-and-ethnic-groups"",""domain"":""https:\/\/www.pewresearch.org"",""credits"":""Note: Children include those who are younger than 18. White children include only those who report being one race and are not Hispanic. In 2001 and earlier, Asian Americans included Pacific Islanders. Data on Asian Americans not available prior to 1987. From 2002-2019, respondents could choose more than one race; White, Black and Asian children include only the single-race components of their populations in these years. Hispanics are of any race.  <br>Source: U.S. Census Bureau historical poverty data, 1976-2019. "",""creditsURL"":false,""creditText"":"" ""},""tooltip"":{""xDateFormat"":""%b %Y""}}];",out/multi_col/data/1.csv,out/multi_col/imgs/1.png,"Before the coronavirus outbreak sent the U.S. economy into a recession, the share of American children living in poverty was on a downward trajectory, reaching record lows across racial and ethnic groups, according to a new Pew Research Center analysis of U.S. Census Bureau data.
In 2019, the year with the most recently available data, 14% of children under age 18, or 10.5 million children, were living in poverty, down from 22%, or 16.3 million, in 2010. All major racial and ethnic groups saw declines since 2010, but the greatest decreases were in the shares of Black and Hispanic children living in poverty. About two-in-ten Hispanic children (21%) were living in poverty in 2019, down from 35% in 2010. In 2019, 26% of Black children were impoverished, dropping from 39% in 2010. Even so, Black and Hispanic children were still about three times as likely as Asian (7%) and White (8%) children to be living in poverty.",line,"['Year', 'Asian', 'White', 'Hispanic', 'Black']",https://www.pewresearch.org/fact-tank/2020/11/30/prior-to-covid-19-child-poverty-rates-had-reached-record-lows-in-u-s/,Social & Demographic Trends
2,About equal numbers of Black and White children are living in poverty,"Number of children living in poverty, by race and ethnicity (in millions)","Note: Children include those who are younger than 18. White children include only those who report being one race and are not Hispanic. In 2001 and earlier, Asian children included Pacific Islanders. Data on Asian Americans not available prior to 1987. From 2002-2019, respondents could choose more than one race; White, Black and Asian children include only the single-race components of their populations in these years. Hispanics are of any race.
Source: U.S. Census Bureau historical poverty data, 1976-2019.","chart[380521] = [{""chart"":{""type"":""line"",""zoomType"":""none""},""subtitle"":{""text"":""Number of children living in poverty, by race and ethnicity (in millions)""},""xAxis"":{""title"":[],""type"":""datetime"",""plotBands"":[{""color"":""#F5F4EF"",""from"":315532800000,""to"":331257600000,""label"":{""text"":"""",""verticalAlign"":""top"",""textAlign"":""center"",""style"":{""color"":""#6D6F71""}}},{""color"":""#F5F4EF"",""from"":362793600000,""to"":404956800000,""label"":{""text"":"""",""verticalAlign"":""bottom"",""y"":-12,""textAlign"":""left"",""style"":{""color"":""#6D6F71""}}},{""color"":""#F5F4EF"",""from"":646790400000,""to"":667785600000,""label"":{""text"":"""",""verticalAlign"":""bottom"",""y"":-12,""textAlign"":""left"",""style"":{""color"":""#6D6F71""}}},{""color"":""#F5F4EF"",""from"":983404800000,""to"":1004572800000,""label"":{""text"":"""",""verticalAlign"":""bottom"",""y"":-12,""textAlign"":""left"",""style"":{""color"":""#6D6F71""}}},{""color"":""#F5F4EF"",""from"":1196485200000,""to"":1243828800000,""label"":{""text"":""RECESSIONS"",""verticalAlign"":""top"",""textAlign"":""center"",""style"":{""color"":""#6D6F71""}}}],""labels"":{""format"":""{value:%Y}""},""lineColor"":""darkgray"",""tickWidth"":1,""tickColor"":""darkgray"",""tickLength"":8},""yAxis"":{""title"":[]},""plotOptions"":{""line"":{""marker"":{""enabled"":false}},""area"":{""marker"":{""enabled"":false}},""bar"":{""stacking"":null},""column"":{""stacking"":null},""pie"":{""visible"":true,""dataLabels"":{""enabled"":true}},""series"":{""connectNulls"":false,""lineWidth"":3.5,""enableMouseTracking"":true,""marker"":{""enabled"":false}}},""misc"":{""inlineTooltips"":false},""html"":{""waypoints"":""true"",""data_tab"":""Data"",""chart_tab"":""Chart"",""share_tab"":""Share"",""height"":""320px"",""iframe"":""true"",""iframe_tab"":""Embed"",""iframe_text"":""Copy and paste the below iframe code into your own website to embed this chart."",""title"":""About equal numbers of Black and White children are living in poverty"",""subtitle"":""Number of children living in poverty, by race and ethnicity (in millions)"",""URL"":""https:\/\/www.pewresearch.org\/chart\/about-equal-numbers-of-black-and-white-children-are-living-in-poverty\/"",""id"":380521,""slug"":""about-equal-numbers-of-black-and-white-children-are-living-in-poverty"",""domain"":""https:\/\/www.pewresearch.org"",""credits"":""Note: Children include those who are younger than 18. White children include only those who report being one race and are not Hispanic. In 2001 and earlier, Asian children included Pacific Islanders. Data on Asian Americans not available prior to 1987. From 2002-2019, respondents could choose more than one race; White, Black and Asian children include only the single-race components of their populations in these years. Hispanics are of any race. <br>Source: U.S. Census Bureau historical poverty data, 1976-2019. "",""creditsURL"":false,""creditText"":"" ""},""tooltip"":{""xDateFormat"":""%b %Y""}}];",out/multi_col/data/2.csv,out/multi_col/imgs/2.png,"The number of impoverished children also declined across racial and ethnic groups. In particular, the numbers of poor Black and White children reached new lows in 2019 (each around 3 million). While there are about as many White children as Black children living in poverty, it’s worth noting that there are more than three times as many White children as Black children in the U.S.
The greatest decline was in the number of Hispanic children living in poverty. In 2019, 3.9 million Hispanic children were living in poverty, down from 6.1 million impoverished Hispanic children nearly a decade earlier. But there are still more Hispanic children in poverty than any other racial or ethnic group, which has been the case since at least 2007. This is probably because Hispanics are the largest and the youngest racial or ethnic minority population in the U.S. and because the Hispanic child poverty rate is relatively high (21%).",line,"['Year', 'Asian', 'White', 'Hispanic', 'Black']",https://www.pewresearch.org/fact-tank/2020/11/30/prior-to-covid-19-child-poverty-rates-had-reached-record-lows-in-u-s/,Social & Demographic Trends
3,"By international standards, 2016 U.S. voter turnout was low",Votes cast in most recent national election as a ...,"Note: Voting-age population (VAP) turnout is derived from estimates of each country's VAP by the International Institute for Democracy and Electoral Assistance. Registered-voter (RV) turnout is derived from each country's reported registration data. Because of methodological differences, in some countries estimated VAP is lower than reported RV. Turnout rates are listed for the most recent national election in each country, except in cases where that election was for a largely ceremonial position or for European Parliament members (turnout is often substantially lower in such elections). Current voting-age population estimates for Iceland and Japan are unavailable.
* National law makes voting compulsory. In addition, one Swiss canton has compulsory voting.
Source: Pew Research Center calculations based on data from International Institute for Democracy and Electoral Assistance, European Election Database, United States Election Project, Office of the Clerk of the U.S. House of Representatives and various national election authorities.","chart[379388] = [{""chart"":{""type"":""scatter"",""zoomType"":""none"",""inverted"":true},""subtitle"":{""text"":""Votes cast in most recent national election as a ...""},""xAxis"":{""title"":[],""type"":""linear"",""alternateGridColor"":""#F4F3EF"",""lineColor"":""darkgray"",""lineWidth"":0,""tickWidth"":0,""tickColor"":""darkgray"",""gridLineWidth"":1,""gridLineDashStyle"":""Dot"",""useHTML"":true},""yAxis"":{""title"":[],""labels"":{""format"":""{value}%""}},""plotOptions"":{""line"":{""marker"":{""enabled"":true}},""area"":{""marker"":{""enabled"":true}},""bar"":{""stacking"":null},""column"":{""stacking"":null},""pie"":{""visible"":true,""dataLabels"":{""enabled"":true}}},""misc"":{""inlineTooltips"":false},""html"":{""waypoints"":""true"",""data_tab"":""Data"",""chart_tab"":""Chart"",""share_tab"":""Share"",""height"":""1000px"",""iframe"":""true"",""iframe_tab"":""Embed"",""iframe_text"":""Copy and paste the below iframe code into your own website to embed this chart."",""title"":""By international standards, 2016 U.S. voter turnout was low"",""subtitle"":""Votes cast in most recent national election as a ..."",""URL"":""https:\/\/www.pewresearch.org\/chart\/by-international-standards-2016-u-s-voter-turnout-was-low\/"",""id"":379388,""slug"":""by-international-standards-2016-u-s-voter-turnout-was-low"",""domain"":""https:\/\/www.pewresearch.org"",""credits"":""Note: Voting-age population (VAP) turnout is derived from estimates of each country's VAP by the International Institute for Democracy and Electoral Assistance. Registered-voter (RV) turnout is derived from each country's reported registration data. Because of methodological differences, in some countries estimated VAP is lower than reported RV. Turnout rates are listed for the most recent national election in each country, except in cases where that election was for a largely ceremonial position or for European Parliament members (turnout is often substantially lower in such elections). Current voting-age population estimates for Iceland and Japan are unavailable.<br> * National law makes voting compulsory. In addition, one Swiss canton has compulsory voting.<br> Source: Pew Research Center calculations based on data from International Institute for Democracy and Electoral Assistance, European Election Database, United States Election Project, Office of the Clerk of the U.S. House of Representatives and various national election authorities."",""creditsURL"":false,""creditText"":"" ""},""legend"":{""align"":""center"",""verticalAlign"":""top"",""x"":0,""y"":50,""itemStyle"":{""color"":""#000000"",""fontWeight"":""normal""}}}];",out/multi_col/data/3.csv,out/multi_col/imgs/3.png,"The 55.7% VAP turnout in 2016 puts the U.S. behind most of its peers in the Organization for Economic Cooperation and Development, most of whose members are highly developed democratic states. Looking at the most recent nationwide election in each OECD nation, the U.S. places 30th out of 35 nations for which data is available.
The highest turnout rates among OECD nations were in Turkey (89% of voting-age population), Sweden (82.1%), Australia (80.8%), Belgium (77.9%) and South Korea (77.9%). Switzerland consistently has the lowest turnout in the OECD: In 2019 federal elections, barely 36% of the Swiss voting-age population voted.
As a consequence, turnout comparisons based only on registered voters may not be very meaningful. For instance, U.S. turnout in 2016 was 86.8% of registered voters, fifth-highest among OECD countries and second-highest among those without compulsory voting. But registered voters in the U.S. are much more of a self-selected group, already more likely to vote because they took the trouble to register themselves.",scatter,"['Country', '% of voting age population', '% of registered voters']",https://www.pewresearch.org/fact-tank/2020/11/03/in-past-elections-u-s-trailed-most-developed-countries-in-voter-turnout/,U.S. Politics & Policy
4,"Origins of the U.S. immigrant population, 1960-2018",% of foreign-born population residing in the U.S. who were born in …,"Note: Other Latin America includes Central America, South America and the Caribbean. Asia includes Central, East, Southeast, and South Asia.
Source: Pew Research Center tabulations of 1960-2000 decennial censuses and 2010, 2015-2018 American Community Surveys (IPUMS).","chart[29234] = [{""colors"":[""#A55A26"",""#DE996A"",""#E7BA9A"",""#F2DBCD"",""#7C441C""],""plotOptions"":{""line"":{""marker"":{""lineWidth"":2,""lineColor"":null,""enabled"":false},""stacking"":""normal""},""area"":{""lineWidth"":0,""marker"":{""enabled"":false},""stacking"":""normal""},""scatter"":{""marker"":{""fillColor"":null}},""bar"":{""stacking"":""normal""},""column"":{""stacking"":""normal""},""pie"":{""visible"":true,""dataLabels"":{""enabled"":true}}},""chart"":{""type"":""area"",""zoomType"":""none""},""subtitle"":{""text"":""% of foreign-born population residing in the U.S. who were born in \u2026""},""xAxis"":{""title"":[],""type"":""datetime""},""yAxis"":{""title"":[],""max"":""100""},""misc"":{""inlineTooltips"":false},""html"":{""waypoints"":false,""data_tab"":""Data"",""chart_tab"":""Chart"",""share_tab"":""Share"",""height"":""400px"",""iframe"":true,""iframe_tab"":""Embed"",""iframe_text"":""Copy and paste the below iframe code into your own website to embed this chart."",""title"":""Origins of the U.S. immigrant population, 1960-2018"",""subtitle"":""% of foreign-born population residing in the U.S. who were born in \u2026"",""URL"":""https:\/\/www.pewresearch.org\/hispanic\/chart\/origins-of-the-u-s-immigrant-population-1960-2018\/"",""id"":29234,""slug"":""origins-of-the-u-s-immigrant-population-1960-2018"",""domain"":""https:\/\/www.pewresearch.org\/hispanic"",""credits"":""Note: Other Latin America includes Central America, South America and the Caribbean. Asia includes Central, East, Southeast, and South Asia.<br>Source: Pew Research Center tabulations of 1960-2000 decennial censuses and 2010, 2015-2018 American Community Surveys (IPUMS)."",""creditsURL"":false,""creditText"":"" ""}}];",out/multi_col/data/4.csv,out/multi_col/imgs/4.png,"The regions of origin for immigrant populations residing in the U.S. have dramatically shifted since the passage of the 1965 Immigration and Naturalization Act. In 1960, 84% of immigrants living in the U.S. were born in Europe, Canada or other North American countries, while only 6% were from Mexico, 4% from Asia, 3% from the rest of Latin America and 3% from other areas. Immigrant origins now differ drastically, with European, Canadian and other North American immigrants making up only a small share of the foreign-born population (13%) in 2018. Asians (28%), Mexicans (25%) and other Latin Americans (25%) each make up about a quarter of the U.S. immigrant population, followed by 9% who were born in another region.",area,"['Year', 'Europe/Canada and other North America', 'Asia', 'Other Latin America', 'Mexico']",https://www.pewresearch.org/hispanic/2020/08/20/facts-on-u-s-immigrants/,Hispanic Trends
5,"Length of time in the U.S., 1970-2018",% of foreign-born population who have lived in the U.S. ...,"Source: Pew Research Center tabulations of 1970-2000 decennial censuses and 2010, 2013-2018 American Community Surveys (IPUMS).","chart[29238] = [{""colors"":[""#A55A26"",""#DE996A"",""#E7BA9A"",""#F2DBCD"",""#7C441C""],""plotOptions"":{""line"":{""marker"":{""lineWidth"":2,""lineColor"":null,""enabled"":true}},""area"":{""lineWidth"":0,""marker"":{""enabled"":true}},""scatter"":{""marker"":{""fillColor"":null}},""bar"":{""stacking"":null},""column"":{""stacking"":null},""pie"":{""visible"":true,""dataLabels"":{""enabled"":true}}},""chart"":{""type"":""line"",""zoomType"":""none""},""subtitle"":{""text"":""% of foreign-born population who have lived in the U.S. ...""},""xAxis"":{""title"":[],""type"":""datetime""},""yAxis"":{""title"":[],""max"":""100""},""misc"":{""inlineTooltips"":false},""html"":{""waypoints"":false,""data_tab"":""Data"",""chart_tab"":""Chart"",""share_tab"":""Share"",""height"":""400px"",""iframe"":true,""iframe_tab"":""Embed"",""iframe_text"":""Copy and paste the below iframe code into your own website to embed this chart."",""title"":""Length of time in the U.S., 1970-2018"",""subtitle"":""% of foreign-born population who have lived in the U.S. ..."",""URL"":""https:\/\/www.pewresearch.org\/hispanic\/chart\/length-of-time-in-the-u-s-1970-2018\/"",""id"":29238,""slug"":""length-of-time-in-the-u-s-1970-2018"",""domain"":""https:\/\/www.pewresearch.org\/hispanic"",""credits"":""Source: Pew Research Center tabulations of 1970-2000 decennial censuses and 2010, 2013-2018 American Community Surveys (IPUMS)."",""creditsURL"":false,""creditText"":"" ""}}];",out/multi_col/data/5.csv,out/multi_col/imgs/5.png,"The nation’s immigrants are more settled today than they were in 1990, when the share of those who had arrived within the past 10 years peaked at 44%. Now, the amount of time that immigrants have spent in the U.S. has grown. In 2018, 73% of immigrants had lived in the U.S. for over 10 years, up from 56% in 1990 (but similar to the share in 1970.)",line,"['Year', '0 to 10 years', 'Over 10 years']",https://www.pewresearch.org/hispanic/2020/08/20/facts-on-u-s-immigrants/,Hispanic Trends
6,"Among new arrivals, Asians outnumber Hispanics",% of immigrants arriving in the U.S. in each year who are ...,"Note: Figures for 2000 to 2004 are based on the household population and do not include arrivals residing in group quarters. For 2000-2017, the shares are computed using immigrants who arrived in the year before the ACS surveys of 2001-2018; for 2018, based on those arriving in 2018 in the 2018 ACS. Race and ethnicity based on self-reports. Asians include only single-race non-Hispanics. Hispanics are of any race.
Source: Pew Research Center tabulations of 2001-2018 American Community Surveys (IPUMS).","chart[29241] = [{""colors"":[""#A55A26"",""#DE996A"",""#E7BA9A"",""#F2DBCD"",""#7C441C""],""plotOptions"":{""line"":{""marker"":{""lineWidth"":2,""lineColor"":null,""enabled"":true}},""area"":{""lineWidth"":0,""marker"":{""enabled"":true}},""scatter"":{""marker"":{""fillColor"":null}},""bar"":{""stacking"":null},""column"":{""stacking"":null},""pie"":{""visible"":true,""dataLabels"":{""enabled"":true}}},""chart"":{""type"":""line"",""zoomType"":""none""},""subtitle"":{""text"":""% of immigrants arriving in the U.S. in each year who are ...""},""xAxis"":{""title"":[],""type"":""datetime""},""yAxis"":{""title"":[]},""misc"":{""inlineTooltips"":false},""html"":{""waypoints"":false,""data_tab"":""Data"",""chart_tab"":""Chart"",""share_tab"":""Share"",""height"":""400px"",""iframe"":true,""iframe_tab"":""Embed"",""iframe_text"":""Copy and paste the below iframe code into your own website to embed this chart."",""title"":""Among new arrivals, Asians outnumber Hispanics"",""subtitle"":""% of immigrants arriving in the U.S. in each year who are ..."",""URL"":""https:\/\/www.pewresearch.org\/hispanic\/chart\/among-new-arrivals-asians-outnumber-hispanics\/"",""id"":29241,""slug"":""among-new-arrivals-asians-outnumber-hispanics"",""domain"":""https:\/\/www.pewresearch.org\/hispanic"",""credits"":""Note: Figures for 2000 to 2004 are based on the household population and do not include arrivals residing in group quarters. For 2000-2017, the shares are computed using immigrants who arrived in the year before the ACS surveys of 2001-2018; for 2018, based on those arriving in 2018 in the 2018 ACS. Race and ethnicity based on self-reports. Asians include only single-race non-Hispanics. Hispanics are of any race.<br>Source: Pew Research Center tabulations of 2001-2018 American Community Surveys (IPUMS)."",""creditsURL"":false,""creditText"":"" ""}}];",out/multi_col/data/6.csv,out/multi_col/imgs/6.png,"Starting as early as 2010, more Asian immigrants than Hispanic immigrants have arrived annually in the U.S., a reversal of historical trends. In the early 2000s, the number of newly arrived Hispanic immigrants greatly outnumbered newly arrived Asian immigrants. Around the time of the Great Recession, Latin American immigration declined sharply, especially from Mexico.",line,"['Year', 'Hispanic', 'Asian']",https://www.pewresearch.org/hispanic/2020/08/20/facts-on-u-s-immigrants/,Hispanic Trends
